{
  "$schema": "https://json-schema.org/draft/2020-12/schema",
  "$id": "https://github.com/ChelseaKR/ca-fish-planting-alerts/schema/snapshot.v2.json",
  "title": "Trout Truck snapshot v2",
  "description": "Every state Trout Truck carries: California (from the same run that builds v1, with the same water ids) and each other state with at least one record. Each state says what its records mean (a schedule of planned stockings, or a report of stockings done) and at what precision (day, week or month). Never render a period finer than its precision. See schema/README.md.",
  "type": "object",
  "additionalProperties": false,
  "required": ["schema_version", "generated_at", "states", "waters", "this_week"],
  "properties": {
    "schema_version": { "const": 2 },
    "generated_at": { "$ref": "#/$defs/datetime" },
    "states": {
      "type": "array",
      "minItems": 1,
      "items": { "$ref": "#/$defs/state" },
      "description": "California first, then by name. A state appears only once it has at least one record; readers must not assume a fixed list."
    },
    "waters": {
      "type": "array",
      "minItems": 1,
      "items": { "$ref": "#/$defs/water" },
      "description": "Every water with at least one published record, California's first (in v1's order), then each state's by id."
    },
    "this_week": {
      "type": "array",
      "items": {
        "type": "object",
        "additionalProperties": false,
        "required": ["water_id", "species"],
        "properties": {
          "water_id": { "$ref": "#/$defs/water_id" },
          "species": { "type": "string", "minLength": 1 }
        }
      },
      "description": "Day- and week-precision listed or reported plants inside their state's current_week. Month-precision plants never appear here. May be empty."
    }
  },
  "$defs": {
    "date": { "type": "string", "pattern": "^\\d{4}-\\d{2}-\\d{2}$" },
    "datetime": { "type": "string", "pattern": "^\\d{4}-\\d{2}-\\d{2}T\\d{2}:\\d{2}:\\d{2}Z$" },
    "https_url": { "type": "string", "format": "uri", "pattern": "^https://" },
    "state_code": { "type": "string", "pattern": "^[A-Z]{2}$" },
    "water_id": { "type": "string", "pattern": "^[a-z]{2,4}-[a-z0-9]+(-[a-z0-9]+)*$" },
    "week": {
      "type": "object",
      "additionalProperties": false,
      "required": ["start", "end", "label"],
      "properties": {
        "start": { "$ref": "#/$defs/date", "description": "A Sunday." },
        "end": { "$ref": "#/$defs/date", "description": "start + 6 days." },
        "label": { "type": "string", "pattern": "^week of \\d{4}-\\d{2}-\\d{2}$" }
      }
    },
    "period": {
      "type": "object",
      "additionalProperties": false,
      "required": ["precision", "start", "end", "label"],
      "properties": {
        "precision": { "enum": ["day", "week", "month", "approximate"] },
        "start": { "$ref": "#/$defs/date" },
        "end": { "$ref": "#/$defs/date" },
        "label": {
          "type": "string",
          "minLength": 1,
          "description": "day: 'YYYY-MM-DD'. week: 'week of YYYY-MM-DD' (a Sunday). month: '<Month> YYYY'. approximate: the agency's own words and the year, verbatim ('April - third week, 2026', 'Spring, 2026'); start and end only bound it. Display it as given; never shorten any of them to a day."
        }
      },
      "allOf": [
        { "if": { "properties": { "precision": { "const": "day" } } }, "then": { "properties": { "label": { "pattern": "^\\d{4}-\\d{2}-\\d{2}$" } } } },
        { "if": { "properties": { "precision": { "const": "week" } } }, "then": { "properties": { "label": { "pattern": "^week of \\d{4}-\\d{2}-\\d{2}$" } } } },
        { "if": { "properties": { "precision": { "const": "month" } } }, "then": { "properties": { "label": { "pattern": "^(January|February|March|April|May|June|July|August|September|October|November|December) \\d{4}$" } } } },
        { "if": { "properties": { "precision": { "const": "approximate" } } }, "then": { "properties": { "label": { "pattern": ", \\d{4}$" } } } }
      ]
    },
    "license_source": {
      "type": "object",
      "additionalProperties": false,
      "required": ["name", "url", "terms_url", "terms_read_on", "commercial_reuse", "attribution_required", "terms_quote"],
      "properties": {
        "name": { "type": "string", "minLength": 1 },
        "url": { "$ref": "#/$defs/https_url" },
        "terms_url": { "$ref": "#/$defs/https_url" },
        "terms_read_on": { "$ref": "#/$defs/date" },
        "commercial_reuse": { "enum": ["permitted", "not-permitted", "unknown"] },
        "attribution_required": { "type": "boolean" },
        "terms_quote": { "type": "string", "minLength": 1, "description": "The license clause, verbatim." }
      }
    },
    "state": {
      "type": "object",
      "additionalProperties": false,
      "required": [
        "code", "name", "agency", "semantics", "date_precisions", "removal_inference",
        "current_week", "as_of", "newest_record", "recency_note", "source", "checks",
        "attribution", "disclaimer", "license", "regions", "counties", "waters_count"
      ],
      "properties": {
        "code": { "$ref": "#/$defs/state_code" },
        "name": { "type": "string", "minLength": 1 },
        "agency": {
          "type": "object",
          "additionalProperties": false,
          "required": ["name", "short_name", "url"],
          "properties": {
            "name": { "type": "string", "minLength": 1 },
            "short_name": { "type": "string", "minLength": 1 },
            "url": { "$ref": "#/$defs/https_url" }
          }
        },
        "semantics": {
          "enum": ["schedule", "report", "plan"],
          "description": "schedule: the agency says when fish will be stocked, and plans can change; say 'scheduled'. report: the agency reports stockings already done; say 'stocked on'. plan: a once-a-year plan in the agency's own words (New York); say 'planned for', never infer a removal."
        },
        "date_precisions": {
          "type": "array",
          "minItems": 1,
          "uniqueItems": true,
          "items": { "enum": ["day", "week", "month", "approximate"] }
        },
        "removal_inference": { "type": "boolean", "description": "True only for schedule states (docs/DECISIONS.md 0016)." },
        "current_week": { "$ref": "#/$defs/week", "description": "What 'this week' means for this state. California: CDFW's stated week. Others: the week containing the date the snapshot was generated, in the state's time zone, which differs from as_of after a failed check." },
        "as_of": { "$ref": "#/$defs/date", "description": "The civil date, in the state's time zone, of the last successful fetch." },
        "newest_record": { "oneOf": [{ "type": "null" }, { "$ref": "#/$defs/period" }] },
        "recency_note": { "type": ["string", "null"], "description": "Show next to this state's data when present (a source that lags)." },
        "source": {
          "type": "object",
          "additionalProperties": false,
          "required": ["name", "url", "fetched_at", "content_sha256", "last_modified"],
          "properties": {
            "name": { "type": "string", "minLength": 1 },
            "url": { "$ref": "#/$defs/https_url" },
            "fetched_at": { "$ref": "#/$defs/datetime", "description": "The last successful fetch." },
            "content_sha256": { "type": "string", "pattern": "^[0-9a-f]{64}$" },
            "last_modified": { "type": ["string", "null"], "description": "The agency's HTTP Last-Modified, verbatim, when it sent one." }
          }
        },
        "checks": {
          "type": "object",
          "additionalProperties": false,
          "required": ["last_attempt_at", "last_success_at", "last_attempt_ok"],
          "properties": {
            "last_attempt_at": { "$ref": "#/$defs/datetime" },
            "last_success_at": { "$ref": "#/$defs/datetime" },
            "last_attempt_ok": { "type": "boolean", "description": "False: the newest fetch failed and the data shown is from last_success_at." }
          }
        },
        "attribution": {
          "type": "object",
          "additionalProperties": false,
          "required": ["text", "url"],
          "properties": {
            "text": { "type": "string", "minLength": 1, "description": "Show verbatim wherever this state's data is shown." },
            "url": { "$ref": "#/$defs/https_url" }
          }
        },
        "disclaimer": { "type": "string", "minLength": 1 },
        "license": {
          "type": "object",
          "additionalProperties": false,
          "required": ["summary", "sources"],
          "properties": {
            "summary": { "type": "string", "minLength": 1 },
            "sources": { "type": "array", "minItems": 1, "items": { "$ref": "#/$defs/license_source" } }
          }
        },
        "regions": {
          "type": "array",
          "items": {
            "type": "object",
            "additionalProperties": false,
            "required": ["code", "name"],
            "properties": { "code": { "type": "string", "minLength": 1 }, "name": { "type": "string", "minLength": 1 } }
          }
        },
        "counties": {
          "type": "array",
          "items": {
            "type": "object",
            "additionalProperties": false,
            "required": ["name", "region"],
            "properties": { "name": { "type": "string", "minLength": 1 }, "region": { "type": ["string", "null"] } }
          }
        },
        "waters_count": { "type": "integer", "minimum": 1 }
      }
    },
    "plant": {
      "type": "object",
      "additionalProperties": false,
      "required": ["period", "species", "status", "count", "first_observed_at", "last_observed_at"],
      "properties": {
        "period": { "$ref": "#/$defs/period" },
        "species": { "type": "string", "minLength": 1 },
        "status": {
          "enum": ["listed", "removed", "reported"],
          "description": "listed: on the agency's schedule or plan as of the latest fetch. removed: was on the schedule, then dropped before its period ended (schedule states only). reported: the agency reports this stocking as done (report states only)."
        },
        "count": { "type": ["integer", "null"], "minimum": 0 },
        "first_observed_at": { "$ref": "#/$defs/datetime" },
        "last_observed_at": { "$ref": "#/$defs/datetime" }
      }
    },
    "location": {
      "oneOf": [
        { "type": "null" },
        {
          "type": "object",
          "additionalProperties": false,
          "required": ["lat", "lon", "source"],
          "properties": {
            "lat": { "type": "number", "minimum": -90, "maximum": 90 },
            "lon": { "type": "number", "minimum": -180, "maximum": 180 },
            "source": { "type": "string", "minLength": 1 },
            "kind": { "enum": ["waterbody", "named_point", "stream_point"] },
            "source_feature_id": { "type": "string", "minLength": 1 }
          }
        }
      ]
    },
    "water": {
      "type": "object",
      "additionalProperties": false,
      "required": [
        "id", "state", "name", "name_status", "slug", "aliases", "counties", "towns", "region",
        "source_id", "source_url", "site_path", "location", "last_period", "next_period",
        "months_note", "plants"
      ],
      "properties": {
        "id": { "$ref": "#/$defs/water_id", "description": "California: cdfw-<StockingWaterID>, the same id v1 uses. Never reused or changed." },
        "state": { "$ref": "#/$defs/state_code" },
        "name": { "type": "string", "minLength": 1 },
        "name_status": { "enum": ["reviewed", "unreviewed"] },
        "slug": { "type": "string", "pattern": "^[a-z0-9]+(-[a-z0-9]+)*$" },
        "aliases": { "type": "array", "items": { "type": "string" } },
        "counties": { "type": "array", "items": { "type": "string", "minLength": 1 } },
        "towns": { "type": "array", "items": { "type": "string", "minLength": 1 } },
        "region": { "type": ["string", "null"] },
        "source_id": { "type": ["string", "null"], "description": "The agency's own key for the water, when it has one." },
        "source_url": { "$ref": "#/$defs/https_url" },
        "site_path": { "type": "string", "pattern": "^/([a-z]{2}/)?water/[a-z0-9]+(-[a-z0-9]+)*/$", "description": "The water's page, from the site root." },
        "location": { "$ref": "#/$defs/location" },
        "last_period": { "oneOf": [{ "type": "null" }, { "$ref": "#/$defs/period" }] },
        "next_period": { "oneOf": [{ "type": "null" }, { "$ref": "#/$defs/period" }] },
        "months_note": { "type": ["string", "null"], "description": "Tennessee: TWRA's month letters, verbatim. Not dates." },
        "plants": { "type": "array", "items": { "$ref": "#/$defs/plant" }, "description": "Oldest first. Empty only for a water the agency lists without a date (then months_note says how it lists it)." }
      }
    }
  }
}
