{
  "schema_version": 2,
  "generated_at": "2026-10-22T02:42:54Z",
  "states": [
    {
      "code": "CA",
      "name": "California",
      "agency": {
        "name": "California Department of Fish and Wildlife",
        "short_name": "CDFW",
        "url": "https://wildlife.ca.gov/"
      },
      "semantics": "schedule",
      "date_precisions": [
        "week"
      ],
      "removal_inference": true,
      "current_week": {
        "start": "2026-09-13",
        "end": "2026-09-19",
        "label": "week of 2026-09-13"
      },
      "as_of": "2026-09-13",
      "newest_record": {
        "precision": "week",
        "start": "2026-09-20",
        "end": "2026-09-26",
        "label": "week of 2026-09-20"
      },
      "recency_note": null,
      "source": {
        "name": "CDFW Fish Planting Schedule",
        "url": "https://nrm.dfg.ca.gov/FishPlants/PublicPlantSearch",
        "fetched_at": "2026-09-13T12:00:00Z",
        "content_sha256": "91b96eb5ae48b3c672ce90a45ec3325921a7b04a7635dc9d016c24e62c8dbb9d",
        "last_modified": null
      },
      "checks": {
        "last_attempt_at": "2026-09-13T12:00:00Z",
        "last_success_at": "2026-09-13T12:00:00Z",
        "last_attempt_ok": true
      },
      "attribution": {
        "text": "Data: California Department of Fish and Wildlife, Fish Planting Schedule (https://nrm.dfg.ca.gov/FishPlants/PublicPlantSearch). Schedule is subject to change; treat all plants as scheduled, not confirmed.",
        "url": "https://nrm.dfg.ca.gov/FishPlants/PublicPlantSearch"
      },
      "disclaimer": "Trout Truck is independent and is not affiliated with or endorsed by CDFW. CDFW: \"all fish plants are subject to change depending on road, water, weather and operational conditions.\"",
      "license": {
        "summary": "CDFW's site-wide Conditions of Use place page content in the public domain with no commercial-use restriction; the related CDFW Fishing Guide dataset on data.ca.gov is explicitly CC-BY. We attribute unconditionally. See docs/LICENSES-AND-ATTRIBUTION.md for the verbatim quotes this is built from.",
        "sources": [
          {
            "name": "CDFW Fish Planting Schedule",
            "url": "https://nrm.dfg.ca.gov/FishPlants/PublicPlantSearch",
            "terms_url": "https://wildlife.ca.gov/Conditions-of-Use",
            "terms_read_on": "2026-09-13",
            "commercial_reuse": "permitted",
            "attribution_required": true,
            "terms_quote": "Ownership — In general, information presented on this web site, unless otherwise indicated, is considered in the public domain. It may be distributed or copied as permitted by law."
          },
          {
            "name": "CDFW Fishing Guide (data.ca.gov, CC-BY)",
            "url": "https://data.ca.gov/dataset/cdfw-fishing-guide2",
            "terms_url": "https://data.ca.gov/dataset/cdfw-fishing-guide2",
            "terms_read_on": "2026-09-13",
            "commercial_reuse": "permitted",
            "attribution_required": true,
            "terms_quote": "License: \"Creative Commons Attribution\". Rights: \"No restrictions on public use.\""
          }
        ]
      },
      "regions": [
        {
          "code": "R1",
          "name": "Northern Region (R1)"
        },
        {
          "code": "R2",
          "name": "North Central Region (R2)"
        },
        {
          "code": "R3",
          "name": "Bay Delta Region (R3)"
        },
        {
          "code": "R4",
          "name": "Central Region (R4)"
        },
        {
          "code": "R5",
          "name": "South Coast Region (R5)"
        },
        {
          "code": "R6",
          "name": "Inland Deserts Region (R6)"
        }
      ],
      "counties": [
        {
          "name": "Lassen",
          "region": "R1"
        },
        {
          "name": "Modoc",
          "region": "R1"
        },
        {
          "name": "Shasta",
          "region": "R1"
        },
        {
          "name": "Trinity",
          "region": "R1"
        }
      ],
      "waters_count": 3
    },
    {
      "code": "MA",
      "name": "Massachusetts",
      "agency": {
        "name": "Massachusetts Division of Fisheries and Wildlife",
        "short_name": "MassWildlife",
        "url": "https://www.mass.gov/orgs/masswildlife"
      },
      "semantics": "report",
      "date_precisions": [
        "day"
      ],
      "removal_inference": false,
      "current_week": {
        "start": "2026-10-18",
        "end": "2026-10-24",
        "label": "week of 2026-10-18"
      },
      "as_of": "2026-09-13",
      "newest_record": {
        "precision": "day",
        "start": "2026-10-09",
        "end": "2026-10-09",
        "label": "2026-10-09"
      },
      "recency_note": null,
      "source": {
        "name": "MassWildlife trout stocking report",
        "url": "https://www.mass.gov/info-details/trout-stocking-report",
        "fetched_at": "2026-09-13T12:00:00Z",
        "content_sha256": "a5ad956d33764c499fff743fd4ac2b638bd236d1869bbd106a62f1f3c516a574",
        "last_modified": null
      },
      "checks": {
        "last_attempt_at": "2026-09-13T12:00:00Z",
        "last_success_at": "2026-09-13T12:00:00Z",
        "last_attempt_ok": true
      },
      "attribution": {
        "text": "Data: Massachusetts Division of Fisheries and Wildlife (MassWildlife), trout stocking report (https://www.mass.gov/info-details/trout-stocking-report).",
        "url": "https://www.mass.gov/info-details/trout-stocking-report"
      },
      "disclaimer": "Trout Truck is independent and is not affiliated with or endorsed by MassWildlife or the Commonwealth of Massachusetts. These are stockings MassWildlife has reported as done, by the day.",
      "license": {
        "summary": "The stocking layer's own license grants permission to copy and use it. It is read through ArcGIS Hub's public download API; the mass.gov page, whose terms allow fair use and nothing more, is never read.",
        "sources": [
          {
            "name": "MassWildlife Stocked Fish (View), ArcGIS item license",
            "url": "https://www.arcgis.com/home/item.html?id=e27aa5ec1ef74659aac1ef12b39510f1",
            "terms_url": "https://www.arcgis.com/home/item.html?id=e27aa5ec1ef74659aac1ef12b39510f1",
            "terms_read_on": "2026-10-12",
            "commercial_reuse": "permitted",
            "attribution_required": false,
            "terms_quote": "All maps and other material provided herein are protected by copyright. Permission is granted to copy and use the materials herein."
          }
        ]
      },
      "regions": [],
      "counties": [],
      "waters_count": 3
    },
    {
      "code": "MI",
      "name": "Michigan",
      "agency": {
        "name": "Michigan Department of Natural Resources",
        "short_name": "Michigan DNR",
        "url": "https://www.michigan.gov/dnr"
      },
      "semantics": "report",
      "date_precisions": [
        "day"
      ],
      "removal_inference": false,
      "current_week": {
        "start": "2026-10-18",
        "end": "2026-10-24",
        "label": "week of 2026-10-18"
      },
      "as_of": "2026-09-13",
      "newest_record": {
        "precision": "day",
        "start": "2026-06-17",
        "end": "2026-06-17",
        "label": "2026-06-17"
      },
      "recency_note": "Michigan DNR records often appear weeks after the stocking itself (the DNR notes \"a delay between a stocking event and a corresponding record\"), so a recent stocking may not be listed yet.",
      "source": {
        "name": "Michigan DNR fish stocking data",
        "url": "https://midnr.maps.arcgis.com/apps/dashboards/77581b13c6984b919ab8ed927496a31f",
        "fetched_at": "2026-09-13T12:00:00Z",
        "content_sha256": "6056af0eeb1025bce1a1f94dd89a4bbc42a55d8a0a3789504fac89c7544b799f",
        "last_modified": null
      },
      "checks": {
        "last_attempt_at": "2026-09-13T12:00:00Z",
        "last_success_at": "2026-09-13T12:00:00Z",
        "last_attempt_ok": true
      },
      "attribution": {
        "text": "Data: Michigan Department of Natural Resources, fish stocking data (https://midnr.maps.arcgis.com/apps/dashboards/77581b13c6984b919ab8ed927496a31f).",
        "url": "https://midnr.maps.arcgis.com/apps/dashboards/77581b13c6984b919ab8ed927496a31f"
      },
      "disclaimer": "Trout Truck is independent and is not affiliated with or endorsed by the Michigan DNR or the State of Michigan. The State provides this dataset \"AS IS\" and makes no warranty of its accuracy, timeliness or completeness. Trout stockings into public waters, and no others.",
      "license": {
        "summary": "The Michigan DNR's stocking dataset is a public record with no restrictions on use, reproduction or distribution. Its terms also ask users to release and indemnify the State, which the owner accepted on 2026-10-13.",
        "sources": [
          {
            "name": "Michigan DNR Fish Stocking Database (dataset license)",
            "url": "https://michigandnr.com/publications/PDFS/Fishing/FishStocking/FishStockingData.csv",
            "terms_url": "https://www.arcgis.com/home/item.html?id=fc7739be5f5247e7bf7f2c6bc9471140",
            "terms_read_on": "2026-10-12",
            "commercial_reuse": "permitted",
            "attribution_required": false,